Document_ID,Essay,CEFR,word_count
AR-130-84014,وسائل التواصل الاجتماعي لديها تأثيرات عديدة على الفرد والمجتمع، ولقد غيرت حياتهم على وجه كامل منذ تم تعريفهم عليها. من الطرق التي تأثر فيها المجتمع هي قلة التواصل البشري؛ أصبح أفراد المجتمع يعتمدون على التواصل الاجتماعي لتأدية واجباتهم الاجتماعية وهذا يمنحهم عذرا لعدم الوصل. بالإضافة إلى ذلك نشر التواصل الاجتماعي الوعي الثقافي إلى المجتمع، ولكن بمقابله أشياء أخرى تافهة لا تفيد ومضيعة الوقت. غير هذا، من الطرق التي تأثر فيها الفرد هي التواكل والتكاسل. أصبح الفرد كسولا يتكل على الهاتف لتأدية معظم واجباته، مما جعله كسولا أيضا في تأدية الواجبات التي لا يمكنه تنفيذها من خلال الهاتف. طريقة أخرى ساهمت في تأثيرها على الفرد هي أن جعلت الهمة والشدة في العمل شيئا صعبا ونادرا بين الناس، وهذا بسبب تعود الفرد على إنجاز كل شيء بطريقة سهلة من خلال التواصل الاجتماعي مما جعله لا يجد الحافز ليشده لإنجاز إنجازات عظيمة تحتاج للشدة، هذا لأنه لم يتعود على الصعوبة. في النهاية لقد أثرت وسائل التواصل الاجتماعي تأثيرا كبيرا على الجميع. منها تأثيرات إيجابية ومنها تأثيرات سلبية، لكن مع هذا بإمكان كل فرد الحرص على نفسه للتقليل من التأثيرات السلبية والاستفادة من الخدمات الإيجابية التي توفرها.,B1,150
AR-130-84446,في الآونة الأخيرة شهد العالم ظاهرة وسائل التواصل الاجتماعي. التواصل الاجتماعي ساهم في تغيير وتطوير كل الناس والحضارات المختلفة، كما ساهم أيضا في التقاء من كانوا يعجزون عن التحدث مع بعضهم البعض وجمع شمل من كانوا مفترقين لأسباب خاصة. لكل شيء في العالم سلبيات وإيجابيات، وهذا ينطبق على وسائل التواصل الاجتماعي أيضا. صحيح أن الوسائل ساعدت على التعرف والتحدث مع الآخرين ولكن ليس الجميع يحسن استخدامها. يعد الابتزاز الإلكتروني من أشد السلبيات لدى وسائل التواصل الاجتماعي وتليه السرقات الإلكترونية، منها سرقة البيانات أو المعلومات الخاصة. كثير من الناس يكونون ضحايا وسائل التواصل لعدم اكتسابهم المعرفة الكافية لوسائل التواصل وكيفية التعامل معها. التطفل والتدخل في شؤون الناس يعد أيضا من سلبيات وسائل التواصل، قد يشارك البعض حياتهم - كالمشاهير - في وسائل التواصل كالسنابتشات والفيسبوك والإنستجرام والعديد منها، ولكن البعض قد لا يكون على دراية ومعرفة كافية بأن الشخص نفسه قد يتعرض للسرقة أو التطفل من قبل الآخرين. مشاركة الناس صور منازلهم أو حتى مكان العمل قد يعتبر خطرا كبيرا على الشخص. البعض قد يشارك صور بطاقة دخول الطائرة وهم أيضا على عدم دراية بأن معلومات الشخص قد تنسرق بكل سهولة. في كل تلك الحالات يقع العديد من الناس في مكيدة وسائل التواصل لهذا يجب على الجميع توخي الحذر، ولكن أيضا الاستمتاع بها بإحسان استخدامها.,B2,200
AR-130-84488,إن وسائل التواصل الاجتماعي هي عبارة عن مجموعة من البرامج التي تساعدنا في التواصل مع الآخرين واكتساب الخبرات، لها سلبياتها وإيجابياتها حيث النتائج تعتمد على طريقة استخدام كل فرد وآخر، حيث إن البيئة والتربية تؤثران في هذه النتائج. قد نلاحظ أنه مع مرور الزمن الأجيال يزدادون ذكاء في استخدام هذه الأجهزة وكأنهم مولودون بهذه المهارات. إن إيجابيات هذه الوسائل عديدة منها أنها توسع الثقافات وتزيد العلم والمعرفة وسهولة الوصول إلى أي معلومة. ولكن يتبعها أيضا مشاكل وتأثير سلبي على الجميع - إن كان صغيرا أو كبيرا - أو على الصعيد الفردي أم على مستوى المجتمع. على المستوى الفردي قد ينشأ عنها عادات سيئة أو تنمر وقد تصل للانتحار وفي بعض الحالات تنمر. أما على مستوى المجتمع سيحدث تفكك وكره بين الناس، هذا من الناحية السيئة. أما من الناحية الجيدة على مستوى الفرد توسيع الفكر وقدرة الوصول إلى أي شيء والاعتماد على النفس، أما المجتمع سينتج عن ذلك مجتمع ذكي ومترابط وستزدهر الدولة.,B1,150
AR-130-84627,التسامح شيء أساسي بالنسبة لنا كدولة عظيمة تستقبل العديد من الشعوب من مختلف البلدان، لذلك لا بد من أن نعسى دائما في تنمية هذه القيمة الأخلاقية من خلال تثقيف المجتمع وتعليمه باتخاذ المهارات اللازمة التي تساعد في تكثيف هذه القيمة الإنسانية. لذلك تسعى دولة الإمارات في إعطاء حصص لازمة في المدارس والجامعات تدعم هذه القيمة الأخلاقية فهي توفر العديد من الأشياء التي تسعى لترسيخ قيمة التسامح والتعايش باللغتين العربية والإنجليزية. وفي أثناء هذه الحصص يقوم الطلاب ببعض النقاشات والنشاطات التي تعلمهم أساليب الحياة الأخلاقية. وأيضا تهتم دولتنا بترسيخ هذه القيمة من خلال الندوات والبرامج التي تشمل جميع الفئات العمرية، لذلك نحن كأبناء دولة الإمارات العربية المتحدة يجب أن نكون مساهمين في تحقيق هذه القيمة التي يحرص عليها قادتنا الأعزاء، فنتمنى أن نصبح لهم خير من يمثل هذه القيمة التعايشية، تزامنا مع عامنا هذا - عام التسامح - المقتبس من والدنا المغفور له الشيخ زايد رحمه الله.,B2,100
AR-130-84660,التواصل الاجتماعي له دور كبير على الفرد والمجتمع منه إيجابي ومنه سلبي، وعلى الإنسان أن يكون حذرا مما يطلع عليه وأيضا مما ينشر بين متابعيه مهما كان عددهم لأن كل شيء له أثر على الأشخاص الذين سوف يطلعون عليه. من الإيجابيات - مثلا - بلا وسائل التواصل الاجتماعي ما كان لدينا القدرة على أن نعرف أن غابة الأمازون حاليا تحترق، وهذه الغابة هي مصدر ٢٠٪ من الأكسجين لنا كبشر على الأرض، لأن الأخبار لن تعلن عن هذه الظاهرة، ومن الوسائل الاجتماعية عرفنا. وهناك مجموعة من الناس جمعوا مبالغ لكي يساعدوا في هذه المشكلة. ولكن لوسائل التواصل الاجتماعي أثرا سيئا، مثلا لو أحد مشهور وله آلاف المتابعين ونشر شيئا خطأ وكل الناس شافوه في هذه الحالة، سيكون هناك مشاكل لأن هذا الإنسان قدوة لغيره. وأخيرا مثل كل شيء وسائل التواصل الاجتماعي لها إيجابياتها وسلبياتها لعل الإنسان يكون حذرا على ما يعمل.,B1,100
AR-130-84687,تختلف آراء الجميع عن التواصل الاجتماعي بسبب كثرة تأثيراته السلبية والإيجابية. فالتواصل الاجتماعي يفتح أبوابا جديدة للتواصل بين أفراد المجتمع، ولكن من الممكن أن تتجه هذه الأبواب إلى طرق مضرة دون التوعية بأخطارها.,B1,0
AR-130-84846,ما هي وسائل التواصل الاجتماعي؟ هي مواقع تعمل على شبكة الإنترنت لكي يحظى الشخص بسهولة التواصل مع الأقارب والأصدقاء وللبحث عن معلومة ما ولمشاهدة الأفلام والأخبار. من المواقع المعروفة اليوتيوب والسنابتشات والإنستجرام وفيسبوك والواتساب وغيرها الكثير. لوسائل التواصل الاجتماعي أثر كبير على الفرد والمجتمع فمنها آثار سلبية ومنها آثار إيجابية. فمن الآثار الإيجابية سهولة نشر النصائح من خلالها لتوعية المجتمع عن أمر ما أو للبحث عن أمر ما. ولكن الآثار السلبية تغلب الآثار الإيجابية لأنها تنشر الفتنة والبغضاء والكراهية بين أفراد المجتمع من خلال نشر الشائعات. ومن الآثار السلبية كذلك التقليد الأعمى للمشاهير سواء كانوا عربا أو أجانب في طريقة ارتداء الملابس، أو صرف مبالغ كبيرة لشراء حقيبة أو قلادة تقدر بعشرات الآلاف لكي فقط يراها الناس. ولوسائل التواصل الاجتماعي دور كبير في تدمير الأسر وتشتيتها من خلال التأثير على عقول المراهقين وأولياء الأمور كذلك. في النهاية لوسائل التواصل الاجتماعي آثار كثيرة فهي لا تعد ولا تحصى فبعضها إيجابية وبعضها سلبية ولكن على أفراد المجتمع توخي الحذر من مخاطرها لكي لا يندموا في المستقبل.,B2,150
AR-130-85294,"منذ دخلت وسائل التواصل الاجتماعي حياتنا غيرت مجرى أغلب الأمور، ولم يقتصر هذا التغيير على فئة معينة من المجتمع بل على جميع طبقاته وأصنافه ككل. بدأ انتشارها كوباء سريع لتصل في غضون أشهر إلى مستوى الضروريات بدلا من أن تكون من الرفاهيات. كان الهدف المبدئي منها وكما يوضح الاسم ""التواصل"" ولكن لم تقتصر هذه البرامج على ذلك لتصبح الآن وظيفة ومصدر دخل للعديد من الأسر، فمنهم من استخدمها للتجارة ومنهم من استخدمها للتسويق. بالنسبة إلى تأثير وسائل التواصل الاجتماعي على الفرد، فلذلك العديد من النواحي والمتغيرات. هناك من يمضي جل يومه على ما لا يفيد ليصل إلى درجة الإدمان وهناك من يستثمر وقته فيها في ما يعود على نفسه بنفع. قد تكون مواقع التواصل الاجتماعي وسيلة فعالة للتعلم في العديد من المجالات، كما أنها منصة تساعد في حل المشاكل إذ إن الأفراد يستطيعون مشاركة وتبادل الآراء والتجارب. في المقابل قد تكون هذه وسيلة لخلق المشاكل، فترى من جال له في نفسه ليفرق بين أصدقاء وعائلات أو يستخدمها للسرقة أو أي أعمال سيئة، فليس لهذا الباب حدود. عند تغلغل مواقع التواصل الاجتماعي إلى جميع أوصال المجتمع وانغماسه فيه تغير تكوينه بشكل كامل. لم تعد المجتمعات مترابطة بالشكل الذي كانت عليه من قبل، أصبح التزاور أمرا نادرا للعديدين، وأصبح التواصل وهميا من خلف الشاشات. ومن وجهة نظر أخرى، ساعدت مواقع التواصل الاجتماعي في جعل العالم مكانا أصغر حيث عملت على تقريب القارات والقلوب ليصبح من السهل التعرف على مختلف الثقافات والاستفادة منها. بشكل آخر، لقد تفكك المجتمع الداخلي وتخللته بعض الفجوات ليشكل مجتمعا أكبر عالميا مترابطا بخيوط دقيقة لا ترى.",C1,200
AR-130-85331,تشهد دولة الإمارات العربية المتحدة تطورا كبيرا من ناحية الحضارة، وذلك يعود لمؤسس هذه الدولة الرائدة الشيخ زايد بن سلطان رحمه الله وأسكنه فسيح جناته. فبقوة إصراره وعزيمته وأحلامه حول هذه الصحراء القاحلة الصفراء إلى جنة مزدهرة خضراء. كانت حضارة دولة الإمارات تعتمد على البساطة وقد تغير كل شيء فور اكتشاف حقول البترول التي ساهمت وبشكل كبير في تنمية الدولة بشكل اقتصادي وحضاري. فقد أصبحت دولة الإمارات العربية المتحدة دولة رائدة في شتى المجالات ولم تكتف بذلك بل سعت الدولة إلى طلب وتحقيق المستحيل وارتقت طموحاتها إلى أن تكون دائما الأفضل في جميع المجالات، مما أدى إلى نمو حضارتها وتطورها عن باقي الدول بعقود. وفي الخاتمة نوجه شكرا كبيرا لوالد هذه الدولة العظيمة الشيخ زايد بن سلطان - رحمه الله - ولحكام الإمارات السبع على جهودهم في تنمية وترقية هذه الدولة التي أصبحت علما يرفرف به كل إنسان على هذه الأرض ومصدر فخر للإنسانية.,B2,150
AR-130-85466,أينما ذهبت سترى الناس بيدهم أحد أخطر الأشياء في أيديهم: الهاتف المحمول. قد يبدو كشيء عادي ولكن ما في الهاتف يضر المجتمع والأفراد أيضا. للأسف يعتمد هذا الجيل على مواقع التواصل الاجتماعي، حيث يقومون بتقليد الموضات الحديثة السيئة والمحرمة التي تؤدي بالمجتمع إلي الفساد والتهور. كثرة استخدام الناس لهذه البرامج سببت التفكك الأسري والتوحد بسبب استخدام الفرد له لأكثر من ثماني ساعات. التوحد والانعزال الذي يغرق فيه المستخدم لا مفر منه، لأنه إذا استمر قد يصبح مريضا نفسيا وغير ناجح في حياته الاجتماعية. زادت هذه البرامج نسبة التنمر بين المراهقين مما أدى إلى الاكتئاب وبعد ذلك الانتحار. تقوم وسائل التواصل الاجتماعي بإعطاء الناس صورة خاطئة عن الحياة السعيدة، فتؤدي بالفرد إلى الاختباء وراء قناع ويتنكر، وتزيد الكراهية حين لا يحصل على ما حصل عليه غيره. قد تكون لها أضرار، ولكنها ساعدت العائلات في التواصل عند بعد المسافات، وتساعد الناس على معرفة عادات وتقاليد دول أخرى. كن ذكيا بما تفعله بوقتك، فالوقت كالسيف.,B1,150
AR-130-85828,التطور الحضاري في دولة الإمارات دولة الإمارات تتطور بشكل كبير كل عشر سنين وهي من أكثر الدول التي تطورت في العالم وتطور في أشياء مثل المستشفيات والمدارس والاهتمام بالنظافة والأمان، وهي توفر جميع الأشياء للناس التي من خارج الدولة وأيضا تطور في علم اللغات، مثلا من خمسة شهور طلع قرار تعليم اللغة الصينية في أغلب المدارس وهذا شيء جميل. والذي نلاحظه أن الفرق بين كل جيل فرق كبير والتطور كبير في الكلام والثقافة وأيضا في تفكيرهم وفي كل سنة الإمارات تتطور ولو في شيء واحد مثلا.,B1,100
AR-130-86032,وسائل التواصل الاجتماعي كلنا نعلم بأن في العصر الحالي مجتمعنا مهووس بوسائل التواصل الاجتماعي، ولكن هذا الهوس أصبح يهددنا كأفراد وكمجتمع، أصبحت تشمل حياتنا اليومية، تأخذ من وقتنا بالساعات، تشغلنا عن العالم الحقيقي. ولذلك اليوم سأتحدث عن وسائل التواصل الاجتماعي وتأثيرها على الفرد والمجتمع. أولا: سأتحدث عن إيجابيات وسائل التواصل الاجتماعي، لأن في النهاية وسائل التواصل الاجتماعي لها غرض لمساعدتنا في التعرف على دول أخرى، وتسنح لنا فرصة للتواصل مع أصدقائنا وعائلتنا بطريقة سهلة وسريعة، أيضا نستطيع أن نتعلم ونرى ما يحصل حولنا في العالم. وأخيرا: إنها طريقة ممتعة لتمضية وقت الفراغ، لكن مع ذلك تحولت هذه الوسائل إلى مشكلة في مجتمعنا سببت هوسا ومشاكل بيننا وبين مجتمعات أخرى، منها الفساد، ومشاكل بين أفراد المجتمع. أصبحت مضيعة للوقت من كثرة تمضية الوقت فيها، وأيضا سببت مشاكل نفسية وبدنية للأفراد، منها الكآبة والحزن والانعزال عن الآخرين، وبدنيا البقاء في مكان واحد لساعات عديدة وقلة النوم من كثرة استخدامها. بعد ما تحدثنا عن إيجابيات وسلبيات وسائل التواصل الاجتماعي، يجب أن نتوصل إلى حل يرضي الكل. أولا: يجب على كل فرد وضع منبه أو وقت محدد يسنح له باستخدام وسائل التواصل الاجتماعي، وبذلك يضع له حدا لاستخدام وسائل التواصل الاجتماعي. أيضا يستطيع أن يأخذ يوما أو يومين دون وسائل التواصل الاجتماعي ليساعده على تطهير ذهنه عنها. وأخيرا يضع لنفسه خطة لليوم ويقضيه مع أشخاص مقربين لتفادي استخدام وسائل التواصل الاجتماعي ويكون تواصله مع الأشخاص في العالم الحقيقي. في النهاية أود أن أقول أن وسائل التواصل الاجتماعي قد يكون تأثيرها إيجابيا أو سلبيا، فلا تفرط في استخدامها واستخدمها لغرض معين أو لوقت محدد حتى لا تتعرض للهوس، عش حياتك وركز على حياتك الحقيقية، وليست التي في وسائل التواصل الاجتماعي.,B2,250
AR-130-86741,التسامح من أهم الأشياء التي تجعل المجتمع متماسكا ويجعل الناس محترمين مع بعضهم البعض حتى إن كانوا من دول مختلفة تماما. فإن الإمارات العربية المتحدة أصبحت ترسخ محتوى التسامح في عقول الناس بطرق مثل مجيء البابا فرانسيس. وإن المرأة أصبحت من رموز التسامح وهي من الفئات التي ترسخ معنى التسامح عند المجتمع. فالإمارات تسير على مذهب الشيخ زايد - رحمه الله - في كل شيء عمله. فعلينا أن نتحدث عن مذاهب الشيخ زايد في التسامح في كل الأماكن التي يكثر فيها الناس مثل المطارات والشوارع المزدحمة والمراكز التجارية. وأيضا نقدر على أن نعلم طلاب المدارس عن التسامح لأنه من أهم الأشياء التي تساعد على ازدهار وتماسك المجتمع فكل شخص يحس بأن لديه مكانا في المجتمع وأن صوته سينسمع.,B1,100
AR-130-86817,وسائل التواصل الاجتماعي تنتشر الأخبار وكل جديد يحدث في كل مكان خلال ثوان عن طريق وسائل التواصل الاجتماعي المتنوعة وذلك يؤثر على الأفراد والمجتمعات والشعوب. وبما أن لكل شيء إيجابيات وسلبيات فذلك ينطبق على هذه الوسائل أيضا، لذلك يجب علينا أن نتعلم الطريقة الصحيحة لاستخدامها وكيفية عدم الوقوع في الخطأ. يمكن للفرد أن يستفيد من مواقع التواصل الاجتماعي بشكل كبير، فمثلا الطلاب يستخدمون برنامج (الواتساب) ليسهل التواصل في ما بينهم عند العمل بشكل مجموعات لمشاريع معينة، بالإضافة إلى وجود قنوات وصفحات تقوم بشرح المواد لجميع المراحل الدراسية. يمكن للفرد أيضا أن يستفيد من خبرات الناس المتوفرة على مواقع التواصل الاجتماعي، فقبل شراء منتج معين يمكن البحث عن أضراره وهل هو فعال أم لا؟. كل هذه الإيجابيات سيمتلكها الفرد الذي يستخدم مواقع التواصل الاجتماعي بحكمة ويأخذ ما يحتاج منها ويترك ما يضره، فهذا يساعد على نمو الفرد وكسب الكثير من المعلومات بطريقة سهلة وسريعة. بالنسبة إلى المجتمع فهو عنصر رئيسي لتحريك وسائل التواصل الاجتماعي. فأحيانا يكون نقل ثقافات المجتمع من خلال هذه البرامج مسليا ولطيفا يمكنك من الانتقال بين الشعوب بضغطة زر، وهذا يساعد في تنمية المجتمعات والتكافل الاجتماعي. في حين أن بعض المجتمعات لا تستخدم هذه الوسائل بطريقة صحيحة وتتعرض للخطر من مجتمعات أخرى وهذا ما يؤدي إلى تفكك المجتمعات بطرق غير متوقعة. تعتمد الكثير من الأمور على مواقع التواصل الاجتماعي، ولذلك تعتبر من أهم المؤثرات على عصرنا الحالي وعصورنا القادمة، فلنتعلم معا كيف نكون أشخاصا فعالين ونستفيد من بعضنا البعض باستخدام هذه الوسائل ليزدهر عالمنا الجميل.,B2,200
AR-130-87139,التواصل الاجتماعي له تأثيرات شديدة على المجتمع ومنها آثار سلبية وإيجابية عديدة. ولذلك يجب على الإنسان الحذر من المواقع التي تتلف العقل والتقرب من المواقع المفيدة والإيجابية.,A2,0
