Document_ID,Essay,CEFR,word_count
AR-130-94052,وسائل التواصل الاجتماعي جميع وسائل التواصل الاجتماعي أصبحت في متناول الجميع من مختلف الأعمار، فهي من الضرورات الآن، أصبح العالم لا يستغني عنها تحت أي ظرف كان، فبها نتواصل وبها نعرف أخبار الدول وبها نقضي أوقاتنا في الفراغ، أهميتها بالغة ووجودها منتشر، لكنه لا بد من وجود تأثير لها. سنبدأ أولا بتأثيرها على الفرد بما أن تقريبا جميع الأشخاص الآن لديهم دخول على مواقع التواصل الاجتماعي، وبما أنه توجد جوانب إيجابية وسلبية لكل شيء في هذا العالم وهذا هو الحال نفسه مع التواصل الاجتماعي. نبدأ بالإيجابي، شكرا لوسائل التواصل الاجتماعي، الفرد في كل المجتمعات الآن يمتلك وعيا أكبر ويستطيع بسهولة الوصول لأي مكان في العالم مع أي شخص عبر شاشة صغيرة. ولكن هناك أيضا التأثير السلبي، وسائل التواصل الاجتماعي مشهورة بقدرتها على تشتيت تركيز الشخص عما هو مهم، كما أنها تشكل خطرا كبيرا على الأطفال أو حتى المراهقين الذين لهم دخول بما أنها تعطي حرية كبيرة في التجول بين المواقع والتطبيقات، كما أنها منفتحة لجميع أنواع العقليات والأفكار في العالم التي وبسهولة ستؤثر على الفرد وتشتت تفكيره وتبعثر معتقداته. الفرد الواحد يشكل جزءا من المجتمع، ولذلك التأثير يمتد من تأثير على فرد واحد إلى تأثير على مجتمع بأكمله. نبدأ بالتأثير الإيجابي: شكرا لوسائل التواصل الاجتماعي أصبح تواصل أفراد المجتمع أسهل وأسرع، كما أنه أصبح من السهل أن نعكس هويتنا كمجتمع كامل إلى العالم من خلال تمثيلها عبر مواقع التواصل الاجتماعي، انفتاح المجتمعات على بعضها أصبح أسهل وأوسع. أما الجانب السلبي فيكمن في تشتت الأفراد عند اجتماعهم في المجالس إذ إن هذه المواقع تشتت الأفراد عن التركيز على التواصل الفعلي. يجب علينا أن ننتبه في استخدام هذه الوسائل، لأنها قد تساهم كثيرا في تطويرنا لكنها أيضا تستطيع بسهولة تدمير الكثير والكثير.,B1,250
AR-130-94320,وسائل التواصل الاجتماعي إن وسائل التواصل الاجتماعي من أهم وسائل التأثير على الفرد والمجتمع، فهي سلاح ذو حدين ولها إيجابياتها وسلبياتها، وتعتمد هذه التأثيرات على طريقة استخدام الفرد لها. من أحد أهم إيجابيات التواصل الاجتماعي أنه ينمي ثقافة مستخدميه من خلال التعرف على ثقافات الشعوب الأخرى وعاداتهم وتقاليدهم، فبوسائل التواصل الاجتماعي يمكنك التواصل مع النصف الآخر من الكرة الأرضية بضغطة زر فقط، وهذا يساهم في تنمية المجتمع وتطويره. ومن المميزات الأخرى أنه يوفر الكثير من الجهد والوقت في عملية البحث، فبدلا من إهدار الوقت في البحث بين الكتب الكثيرة يمكنك فقط كتابة ما تريد وستحصل على كل المعلومات التي تريدها في ثوان معدودة. مقابل كل هذه الإيجابيات لدينا أيضا العديد من السلبيات، فالبعض يستخدم وسائل التواصل الاجتماعي في ما لا يفيده، ويهدر الكثير من الوقت دون جدوى، فقد يستخدمها البعض لساعات طويلة مما يعود بالضرر على صحة الفرد. كما أن هذه الوسائل قد تدخل علينا بعض العادات التي لا تليق بمجتمعنا وديننا وتؤثر هذه العادات سلبا على المجتمع وتؤدي إلى ضياع الهوية الوطنية. وأخيرا - كما ذكر في السابق - إن وسائل التواصل الاجتماعي لها سلبياتها وإيجابياتها، ويعتمد تأثيرها اعتمادا كليا على طريقة استخدام الفرد لها. ومن وجهة نظري إن إيجابياتها تتغلب على العديد من السلبيات إذا كنت تستخدمها بطريقة سليمة.,B2,200
AR-130-94968,وسائل التواصل الاجتماعي لها تأثيران على الفرد والمجتمع، ومفهوم التواصل الاجتماعي هو برامج إلكترونية منوعة يمكن لمستخدميها التواصل مع الآخرين أو نشر الصور والفيديوهات والكثير من الأشياء فيها. عادة ما تكون إيجابية أو سلبية لذلك يجب الحرص على اتباع التعليمات للابتعاد عن السلبية. تأثير التواصل الاجتماعي على الفرد من الفوائد اكتساب المعلومات وتطوير الذات، تبادل صفحات حوارية مع الأصدقاء وتبادل الرأي والنقاش عن مواضيع مختلفة. تفسح مجال الإبداع في ذهن الفرد ويكتسب الفرد الوعي وما يدور من حوله من الأخبار والمستجدات الجديدة. فيها فرصة مميزة لاكتساب المعلومات وتوسعة الابتكار في ذهن كل فرد. تأثيراتها السلبية والأضرار مكنت للفرد الانعزال عن المجتمع وإضاعة الوقت، نشر الإشاعات وترويجها أيضا يسبب المشاكل القانونية. تأثير التواصل الاجتماعي على المجتمع احتمال أن يكون سلبيا أو إيجابيا، من الإيجابيات أنه يمكن للمجتمع نشر المعلومات عن المجتمع ومساعدة الآخرين والحرص على المعرفة في الأخبار الحصرية، سيبدو كعالم صغير فيه المجتمع من خلف الشاشات الإلكترونية. السلبيات ومن أهمها ترويج المعلومات الخاطئة وزيادة الكراهية والعنصرية بين أفراد المجتمع. في رأيي عن كيفية الابتعاد عن السلبيات يجب الرقابة والوعي والتثقيف بين أفراد المجتمع ونشر الإيجابيات فقط وعدم التشجيع على نشر المعلومات الخاطئة. يجب على الفرد والمجتمع الاستفادة من التواصل الاجتماعي، فنحن في العصر الحديث ونبني ونطور من أنفسنا كل يوم بعد يوم.,B1,200
AR-130-94976,العنوان: وسائل التواصل الاجتماعي ظهرت في السنين الأخيرة برامج تستخدم للتواصل عن طريق الإنترنت تدعى وسائل التواصل الاجتماعي منها: (الإنستجرام)، (السنابتشات)، (واتساب) إلخ. هذه الوسائل أثرت على الفرد والمجتمع بطرق عدة، منها سلبية ومنها إيجابية. إيجابيات وسائل التواصل الاجتماعية كثيرة، منها أنها ساعدت على تطوير العلاقات بين أفراد المجتمع، فمن خلالها بدأ الأفراد يتواصلون مع بعضهم البعض صوتا وصورة. فمثلا هناك برامج مخصصة لمكالمات الفيديو والتي تمنح للمستخدم الفرصة أن يرى ويتكلم مع شخص آخر. أيضا ساهمت هذه البرامج في شهرة بعض الدول والحضارات وأيضا الأشخاص لأنها وفرت طرقا سهلة لنشر الصور والفيديوهات عبر الإنترنت وساعدت المستخدم بأن يوصل رسالته للمتلقي بطرق سهلة وحديثة لا تتطلب مجهودا كبيرا. بما أن هناك إيجابيات لوسائل التواصل الاجتماعي، هناك أيضا سلبيات عدة. من بعد ظهور هذه الوسائل أصبح بعض الأفراد والمراهقين خاصة يستخدمون الهواتف النقالة والأجهزة الإلكترونية لفترات طويلة لحد الإدمان، وهذا أثر على حياتهم الواقعية وحياتهم مع أفراد عائلتهم. فبسبب هذه الوسائل أصبح البشر يتناقشون ويعبرون عبر هذه الوسائل فقط، وهذا أثر على قدرتهم على التواصل مع الأفراد الآخرين وجها لوجه. أيضا أصبحت العلاقات بين أفراد الأسرة والعائلة ضعيفة لأن كل فرد يفضل الجلوس واستخدام وسائل التواصل الاجتماعي عبر الأجهزة الإلكترونية بدلا من الجلوس كعائلة. إضافة إلى ذلك، بسبب سهولة انتشار الأخبار عبر هذه الوسائل تم استغلالها لنشر الفساد والشائعات بين أفراد المجتمع وبدأت تتنقل من فرد إلى آخر. لذلك أثرت وسائل التواصل الاجتماعي على الأفراد سلبيا وإيجابيا.,C1,200
AR-130-95365,يتميز عصرنا الحديث بالتطور والتحول الإلكتروني. في هذه السنوات الأخيرة شهدنا على انتشار الكثير من وسائل الاتصال بالكثير من الأشكال والمواصفات. لهذه الوسائل الكثير من التأثيرات، منها الإيجابية ومنها السلبية على الفرد والمجتمع. من التأثيرات الإيجابية التي حصلنا عليها من وسائل التواصل الاجتماعي أنها أصبحت من أهم وسائل التواصل الفعالة والسريعة بين الناس في الدولة ومن خارج الدولة. إحدى إيجابيات هذه الوسائل أنها مصدر مهم وكبير لزيادة ثقافتنا ومعلوماتنا، حيث أصبحت هناك العديد من المواقع والطرق لنستفيد ولنتعلم المزيد. إنها طريقة للتعرف ولبدء علاقات جديدة مع ناس جدد حول العالم وللتعرف على ثقافات وعادات وتقاليد جديدة. إنها أيضا وسيلة فعالة لمعرفة آخر الأخبار المنتشرة حولنا - المحلية والعالمية - في دقائق. تعد وسائل التواصل الاجتماعي مصدرا مهما للترفيه ولتقضية وقت الفراغ، فمن يريد أن يرفه عن نفسه في وقت فراغه يستطيع استخدام أحد هذه الوسائل للتصفح فيها ولمشاهدة بعض الأفلام والصور. تتعدد إيجابيات وسائل التواصل الاجتماعي، لكن لا زال هناك بعض من التأثيرات السلبية. من بعد انتشار هذه الوسائل أصبح خروجنا إلى خارج المنزل للترفيه محدودا، وأصبحنا لا نرى أصدقاءنا بكثرة لأننا ارتبطنا بهذه الوسائل للتواصل معهم. أصبح الجلوس والتجمع مع الأصدقاء والأهل من دون أن نمسك الهواتف لكي نتصفح وسائل التواصل الاجتماعي مستحيلا لأنه أصبح جزءا مهما من يومنا. لهذه الوسائل تأثير سلبي على الأطفال أيضا ليس فقط كبار السن. أصبحت طفولتهم ملتفة حول هذه البرامج ولم يعودوا يعيشون طفولتهم مثل الأجيال السابقة. قبل ظهور هذه البرامج كانت لدى الأطفال اهتمامات مختلفة مثل اللعب في الحديقة والخروج إلى الأسواق التجارية والذهاب إلى الملاهي، أما الآن أصبحوا فقط يفكرون بآخر البرامج المتوفرة وأحدث الإلكترونيات. لوسائل التواصل الاجتماعي الكثير من التأثيرات، منها الإيجابية ومنها السلبية، لكن إذا استخدمناها بطريقة سليمة لن تؤثر علينا بطريقة سلبية.,B2,250
AR-130-95601,مع التطور الكبير في المجال التكنولوجي عالميا ظهرت إحدى البرامج التي كان لها دور كبير في تطوير التواصل بين المجتمعات والحضارات تسمى بمواقع التواصل الاجتماعي. وبالفعل حدث ما هو متوقع ومطلوب من مصممي هذه البرامج من تطور إيجابي في أساليب التواصل في المجتمع. ومثل أي اختراع تكنولوجي حدث ما كانوا غافلين عنه من أعراض سلبية تؤثر على الفرد والمجتمع تأثيرا سلبيا والقليل من المشاكل الصحية. شهدت مواقع التواصل الاجتماعي الشهيرة تأثيرا كبيرا على الفرد، إذ أصبح الفرد يحب الجلوس وحيدا مما أدى إلى بعض الحالات من الانعزال عن المجتمع وأصبح يشكل أحيانا أضرارا جانبية للعين مما يستدعي مراجعة طبيب عيون لمعالجة هذه المشكلة في حال استخدم الفرد مواقع التواصل الاجتماعي بكثرة يوميا. وأحدثت أيضا بعض الآثار الإيجابية كتواصل أسهل وأسرع بين المجتمعات على مدار جميع دول العالم في الكرة الأرضية. ومن أشهر مواقع التواصل الاجتماعي سنابتشات وإنستجرام وتويتر، جميعها تستخدم مجانا دون فرض رسوم للاشتراك مما ساعد على انتشارها على نطاق واسع في العالم وبكثرة في المجتمع العربي. وأصبحت مواقع التواصل الاجتماعي سوقا للمشاهير لعرض إعلاناتهم والترويج عن بضاعة الغير سواء كانت من الشركات أو من المشاريع الصغيرة للأفراد. أحيانا تعرض على هذه المواقع أدوية غير مرخصة من وزارة الصحة في الدولة المستخدمة للإعلان مما يحول هذا الإعلان من إعلان تجاري ومادي إلى سلعة قاتلة تسبب الضرر الصحي والاقتصادي للفرد والمجتمع. وغالبا ما تكون هذه السلع منتجات التخسيس أو إنقاص الوزن لانتشار السمنة بشكل كبير في العالم. قبل استخدام مواقع التواصل الاجتماعي يجب علينا أن نكون على علم بكافة السلبيات والإيجابيات لتجنب حصول المشكلات وعدم استخدام أي منتجات تعرض في هذه المواقع قبل السؤال عنها والتأكد من صحة نتائجها. ومن المهم أيضا تخصيص أوقات لاستخدام مواقع التواصل الاجتماعي وعدم استخدامها لأكثر من أربع ساعات يوميا تقريبا لتجنب الأعراض السلبية الناتجة عن كثرة استخدامها والحفاظ على الصحة.,B2,300
AR-130-95626,يعد التسامح أحد أهم الصفات التي يجب أن يتحلى بها الإنسان في حياته، حيث إن التسامح يخلق مجتمعات راقية ومتحضرة تسعى دوما إلى التطور والارتقاء، وإن فقدت المجتمعات صفات التسامح سيفقد العالم النظام الذي هو عليه، وستعم الفوضى في كل مكان. الصفات الحميدة هي الإرث الحقيقي للإنسان بعد مماته، فلا يتمنى أحد أن يودع هذا العالم إلا وقد امتلك شيئا من هذه الصفات ما يجعل له ذكرا حسنا بعد رحيله، ويعد التسامح أهمها، حيث إن بالتسامح تبنى المجتمعات بناءا صحيحا، لذلك يجب أن نعزز ثقافة التسامح في مجتمعاتنا وزرعها في صغارنا وترسيخها في كبارنا، حيث إن هذا ما أمر الله به، وهذا ما كان عليه نبينا، عليه الصلاة والسلام، حيث إن الله كريم يحب العفو سبحانه، وكان عليه الصلاة والسلام سمحا يحب الخير للناس، وكما أن الإسلام دين سمح ليس فيه من العسر شيء فيا لها من صفة حميدة! محظوظ من اكتسبها وطبقها خير تطبيق. وقد ساهمت دولة الإمارات العربية المتحدة في ترسيخ قيم التسامح بين أفراد شعبها، وبدأت بذلك منذ بداية الاتحاد وصولا إلى اليوم، حيث إننا اليوم في عام التسامح، نعلم صغارنا السماحة في كل شيء، ونزرع فيهم صفة العفو عند المقدرة، فذلك من صفات والدنا وقائدنا الشيخ زايد رحمه الله، وهي في أبنائه زرعها هو كما أنبت الأرض زرعا، فأصبحت هذه الصفة هي ما تمثلنا كأبناء زايد، وأصبحت الإمارات رمزا للتسامح والرقي والتطور في جميع المجالات. إن في التسامح رفعة للإنسان، فيجب علينا التمسك بقيم التسامح وعدم إهمالها مهما تغير الزمان والمكان، ويجب أن نتذكر كيف أن التسامح رفع المجتمعات إلى حيث شاءت، وبالتسامح سنصل إلى حيث نشاء.,C1,250
AR-130-95796,جميعنا نعلم أن مواقع التواصل الاجتماعي لها تأثير كبير على الأفراد والمجتمع، منها الإيجابي ومنها السلبي. سوف نتطرق في هذا الموضوع إلى بعض هذه التأثيرات. سوف أبدأ بالسلبي أولا ومن ثم الإيجابي. أولا يوجد الكثير من الناس الذين يستعملون هذه البرامج بهدف الإيقاع بالآخرين وخداعهم، فمن يتقمص شخصية ناس أبرياء، ومن يكذب على الغير بهدف الحصول على الأموال، ولدينا من يدخل إلى أجهزة الآخرين بهدف الحصول على بعض الصور والمعلومات الشخصية يبدأ بنشرها في كل مكان وهذا يتسبب في أذية المجني عليه نفسيا ويسبب له المشاكل. ثانيا توجد الكثير من العصابات التي تسرق الأموال عن طريق تقمصها لشخصية موظف البنك. وهناك من تصيبه الكآبة والعزلة عن العائلة والمجتمع بسبب كثرة الاستخدام. قد ذكرنا بعضا من السلبيات التي قد يستفيد منها البعض، سوف نذكر بعضا من الإيجابيات الآن. عن طريق برامج التواصل الاجتماعي يتمكن الفرد من التواصل مع أشخاص من دول العالم وبهذا يعزز ثقافته ويكتسب المزيد من المعلومات حول دولة الشخص، ويسهل التواصل مع العائلة أينما كان. هذه الأيام جميع الناس يمكنهم الاستفادة من برامج التواصل الاجتماعي عن طريق إطلاق علامتهم التجارية الخاصة، فيكون هذا مصدر دخل عن طريق هذه البرامج. يعتقد البعض أن هذه البرامج عديمة الفائدة لكن الكثير من الأشخاص يستغلون حساباتهم في نشر النصائح وتوعية المجتمع. في النهاية لا يمكننا الحكم على الكتاب من عنوانه، أي ليس بسبب موقف أو قصة أحكم على البرنامج أنه سيئ، فكل الأشياء لها إيجابياتها وسلبياتها. شكرا.,C1,200
AR-130-95921,وسائل التواصل الاجتماعي لها مخاطر وأضرار كثيرة منها ضعف النظر والكسل وعدم التواصل مع أفراد العائلة. الكثير من الناس لا يشعرون أن وسائل التواصل الاجتماعي لها مخاطر عليهم وعلى الذين حولهم. النظر يعد من أهم الحواس لدى الإنسان، فالنظر شيء ثمين. الكثير من المراهقين يجلسون أمام الهاتف أو الحاسوب لساعات طويلة دون الشعور بمرور الوقت، فيبدأ النظر بالضعف وتتعب الأعين من الضوء وتحمر، تطلب الأعين الراحة. يجهل المراهقون ذلك ولا يهتمون لضعف النظر، فيجلسون أمام الهاتف لساعات طويلة، بعد ذلك يلبسون النظارة الطبية ويجلسون على مواقع التواصل الاجتماعي لأنهم يظنون أن نظرهم لن يضعف مرة أخرى. الكسل يعد من أسوأ الصفات لدى الإنسان. العديد من الناس يجلسون على السرير أمام الهاتف يتصفحون مواقع التواصل الاجتماعي، لا يتحركون من مقعدهم. هذه العادة خطرة للجسم وعلى صحة الإنسان، فالجسم يحتاج إلى الحركة والمشي أو الرياضة. فخطر جدا على الجسم أن يجلس في نفس الموضع لساعات أو يوم كامل فيمرضون ويتعب جسمهم. التواصل مع أفراد العائلة والجلوس معهم يجلب السعادة للإنسان، لكن إذا انعزل الإنسان في غرفته مع حاسوبه وهاتفه لن يتذكر أهله وأفراد عائلته. ذات يوم قالت لي فتاة قصتها مع مواقع التواصل الاجتماعي وكيف أثرت على حياتها مع أهلها. قالت الفتاة أنها كانت تجلس ساعات طويلة في غرفتها على هاتفها، لا تتحرك من مقعدها ولا تخرج مع أهلها، كانت منعزلة عن حياتها الاجتماعية، فذات يوم سمعت أهلها في غرفة المعيشة يضحكون ويستمتعون بوقتهم مع بعض، وقالت أنها سترجع بعد ساعة. مرت الساعة، خرجت الفتاة لأهلها لكن انصدمت عندما رأت أن أهلها قد ذهبوا إلى النوم، فأدركت بعدها أنها إذا لم تغير نمط حياتها سوف تكون وحيدة لا أحد يسأل أو يستفسر عنها. في الختام نستطيع أن ندرك أن لمواقع التواصل الاجتماعي مخاطر عديدة منها الكسل وضعف النظر وعدم التواصل مع العائلة وأفراد الأسرة. هناك الكثير من العادات الخطرة التي لم أتكلم عنها، لكن بالنسبة لي أن هذه الثلاثة مخاطر أهمها.,B1,300
AR-130-95973,التواصل أصبح جزءا لا يتجزأ من حياتنا اليومية. مع تطور التكنولوجيا وتوفر الإنترنت لكافة الناس في أنحاء العالم ساهم ذلك في التأثير على فئة كبيرة من الناس من مختلف الأعمار، ولا سيما المراهقون الذين يكثرون في استخدامهم لتلك الأجهزة للتواصل ومتابعة المشاهير أو للتحدث مع أصدقائهم. ونعلم أن وسائل التواصل الاجتماعي لديها إيجابيات وسلبيات كثيرة ومتعددة ومن فوائدها: أولا بسبب توفر المعلومات وسهولة الوصول إليها أصبح بحوزتنا المقدرة على متابعة مجموعات مختلفة من الناس الناجحين والمثابرين الذين وصلوا إلى القمة.,B1,50
