Document_ID,Essay,CEFR,word_count
AR-130-192528,وسائل التواصل الاجتماعي تؤثر تأثيرا قويا على الفرد والمجتمع وبالأخص على الأطفال. في الوقت الحالي الجميع أصبح على وسائل التواصل الاجتماعي. من أهم أضرارها أنهم لا يجلسون مع الأهل، جميع الوقت على الهاتف ووسائل التواصل الاجتماعي، وهذا مضر للصحة وأيضا يشتت عقل الأطفال لأن البعض ينشرون صور عنف أو قصصا مرعبة وهذا خطر جدا. وأيضا الجميع أصبح يظهر إشاعات عبر وسائل التواصل الاجتماعي لكي يصبح مشهورا. ومن الممكن أن تسبب أمراضا من كثرة استخدامها مثل مرض الصرع أو التوحد وأيضا يمكن أن تسبب فتنة بين المجتمع، وهذا من أضرار وسائل التواصل الاجتماعي. وتوجد فوائد لوسائل التواصل الاجتماعي، يساعد التواصل الاجتماعي على سهولة التسويق عبر المواقع بدلا من الذهاب إلى السوق، وأيضا توجد مهارات مثلا اللغة الإنجليزية تساعدنا على تقوية لغتنا في الإنجليزي وهذا شيء مفيد. وفي النهاية وسائل التواصل الاجتماعي توجد لها أضرار كثيرة وبعض الفوائد.,B1,100
AR-130-192582,وسائل التواصل الاجتماعي أسهل وأسرع وسيلة للتواصل للأصدقاء والأهل، ويمكن فيها نشر الصور والفيديوهات، ولكن لها تأثيرات على المجتمع والإنسان عندما يستخدمها بطريقة خاطئة في نشر الصورة الخاطئة، واستعمال الوسائل بطريقة مؤذية للآخرين وأيضا استعمالها بكثرة ولساعات طويلة.,B1,0
AR-130-192654,نشهد هذه الأيام تطورا كبيرا في جميع المجتمعات والدول منه السلبي والإيجابي على الفرد والمجتمع كوسائل التواصل الاجتماعي. لوسائل التواصل الاجتماعي أثر كبير على الفرد، فاليوم أصبح الفرد يتكاسل عن أداء المهمات، كما قد يصاب الفرد بأضرار جسدية قد تستمر معه مدى الحياة مثل آلام الظهر وضعف النظر وانحناء الرقبة، ولكن لا يدرك المرء تلك الأضرار إلا وقت حدوثها. أما بالنسبة للمجتمع فقد أصبح الناس أقل تواصلا بالنسبة للتجمعات، فأصبحوا يرون أنه من الأفضل التحدث عبر الهاتف ولا يقضون الوقت في الجلوس مع عائلتهم وهذا قد يؤثر سلبا على المجتمع. أما بالنسبة لفوائد وسائل التواصل الاجتماعي أنها تسهل على الفرد الحرية للتعبير عن نفسه وكل ما يجول بخاطره. وبالنسبة للمجتمع إن الوسائل قد طورت العلاقات بين المجتمعات المختلفة فأصبح الناس يكونون علاقات الصداقة وغيرها مع الأشخاص من الدول الأخرى مما يؤدي لتقوية الروابط الاجتماعية.,B2,100
AR-130-192696,إن وسائل التواصل الاجتماعي لها دور كبير ومهم في حياتنا اليومية إما أن يكون فعالا أو هداما، ويعود ذلك لكيفية استخدام الشخص لهذه المواقع. ويمكننا أن نستخدم مواقع التواصل الاجتماعي في تبادل الخبرات الحيايتة وتفقد أحوال الأقرباء البعيدين والتعرف على أصدقاء كثيرين. ويمكننا أن نكتسب الكثير من الخبرات والثقافات العامة، بينما لها مخاطر وأضرار كثيرة قد تجعل الأشخاص منعزلين عن بعضهم البعض والاندماج في عالم آخر. وقد ينشغل الشخص عن تأدية بعض الأعمال والواجبات المنزلية، وقد تكون هناك فرصة قوية لنشر الإشاعات وتصديقها وسهولة نشرها. ويجب أن يكون هناك رقابة ذاتية ومعرفة الخطأ وتداركه. ويجب أن يكون هناك وعي، يمكن تقديم دورات توعوية في المدرسة ولدى الأبوين ويجب أن يكونوا حريصين على مراقبة أبنائهم. وإن وسائل التواصل الاجتماعي لها دور كبير في حياتنا والجميع يحتاج أن يتواصل مع الآخرين وتوسعة خبراته في الحياة والاطلاع إلى الأحداث الجديدة في الحياة. ويجب أن نتتبع سبل توخي خطرها ويجب أن نكون أكثر رشدا في استخدامها.,B1,150
AR-130-192707,انتشرت في الآونة الأخيرة وسائل التواصل الاجتماعي ولعبت دورا مهما في عصرنا هذا. البعض يستخدمها لغرض البحث عن معلومة والبعض يستخدمها بشكل خاطئ، ولكن يجب أن يكون هناك وعي عند استخدام هذه الوسائل. وفي هذا المقال سوف نتحدث عن إيجابيات وسلبيات وسائل التواصل الاجتماعي وتأثيرها على الفرد والمجتمع. من إيجابيات وسائل التواصل الاجتماعي عندما تريد البحث عن معلومة من السهل الحصول عليها بمجرد البحث عنها لأنها تسهل لك المهمة وتسرعها، وهذا يجعل المجتمع أكثر ثقافة بما يدور حوله من معلومات. وأيضا من أهمية هذه الوسائل أنها تجعل الأشخاص أكثر تواصلا مع بعضهم البعض، وهذا يزيد العلاقات الاجتماعية بين الناس ويجعلهم أكثر تقربا من بعض لأننا في زمن يصعب الوصول للأشخاص بسبب انشغالاتهم في الحياة عكس ما كانت عليه الأجيال الماضية. ومن سلبيات هذه الوسائل أن البعض يستخدمها بشكل خاطئ ويفرط باستخدامها وهذا يؤثر على صحته وأيضا على وقته وتحصيله الدراسي. وأيضا يقوم بعض المستخدمين بانتهاك شخصية الآخرين وهذا يؤثر على المجتمع.,B2,150
AR-130-192747,تعتبر وسائل التواصل الاجتماعي تسهيلا لعملية التواصل بين الأصدقاء والعائلة، وكذلك تسهل على الشخص تعلم معلومات جديدة في التواصل الاجتماعي. وهناك الكثير من المواقع التي تمكن للشخص التواصل، وأيضا تأثيرات تلك المواقع لا تنحصر على الإيجابيات فقط أو السلبيات فحسب. هناك الكثير من التنمر في مواقع التواصل وهذا أيضا يؤدي إلى العنصرية بين المجتمع. إن احتكاك الفرد بعالم التواصل الاجتماعي يؤدي إلى اختراق شخصية افتراضية غير شخصيته وذلك من أجل التلاعب. رغم أهمية التواصل الاجتماعي - فهي مهمة للمجتمع - لكن هناك الكثير من الآراء حول انعكاسات استخدامها أحيانا. فهناك بعض من يراها نعمة والبعض الآخر يراها نقمة نظرا لانعكاساتها السلبية والتي يجب التعامل معها بجدية. يمكن أن يتأثر الأطفال بشكل كبير بمواقع التواصل الاجتماعي، وذلك لأن بعض الناس يشاركون الصور التي قد تحتوي على العنف أو المشاهد غير المناسبة مما يلحق الضرر بسلوك الأطفال والمراهقين وأيضا المجتمع، لذلك يجب على الأسرة أن تتعامل مع أطفالها.,B1,150
AR-130-192751,وسائل التواصل الاجتماعي منتشرة كثيرا في هذا العصر المواكب الحديث، تعددت استخداماتها وتعتبر سلاحا ذا حدين ولها تأثير إيجابي وسلبي على الفرد والمجتمع. التأثير الإيجابي على الفرد يمكن التواصل الشخصي التواصل مع أفراد العائلة والأصدقاء، ومشاركة الأفكار وأيضا في التجارة. أما التأثير الإيجابي للمجتمع هو معرفة ما يدور حول العالم ورغبات أفراد المجتمع. التأثير السلبي للفرد هو الإدمان والابتزاز وضياع الوقت وعدم القدرة على السيطرة والتحكم في استخدام التواصل الاجتماعي. التأثير السلبي للمجتمع هو انتشار الشائعات والأسرار. لا بد من مراقبة أنفسنا في استخدام وسائل التواصل الاجتماعي واختيار الطرق الصحيحة لكي لا نقع في سلبياته.,B1,100
AR-130-192885,هناك الكثير من وسائل التواصل الاجتماعي التي تؤثر تأثيرا سلبيا وإيجابيا على الفرد وعلى المجتمع. أصبح تداول الرسائل في وسائل التواصل الاجتماعي أمرا سهلا هذه الأيام، مما أدى إلى الخصام والنزاع عبر وسائل التواصل الاجتماعي بشكل يومي. أثرت وسائل التواصل الاجتماعي على المجتمع كثيرا مما أدى إلى خصام وتفكك بعض الأسر وتشتت الأطفال. أصبح لدى كل شخص حساب على هذه الوسائل وهذا السبب أدى إلى زيادة عدد الخلافات والخصام عبر هذه الوسائل. أثرت وسائل التواصل الاجتماعي تأثيرا سلبيا على المجتمع الغربي والعربي منها تعاطي المخدرات وغيرها. أثرت تأثيرا إيجابيا على فئة من المجتمع. آمل أن يكون هناك قانون يعاقب كل شخص يسيء بأي شكل لأي شخص بدون أي شكوى لأي مسؤول، وبذلك سوف تقل آثار وسائل التواصل الاجتماعي. في هذه الأيام كثرت هذه المشاكل في دولة الإمارات العربية المتحدة.,B1,100
AR-130-192922,للتسامح أهمية كبيرة في المجتمع فهو العفو وتجاهل أخطاء الآخرين لكسب محبتهم من أجل الحد من العنف والنزاعات، يحتاج المجتمع أن يدرك ما مدى أهمية مسامحة الآخرين فيجب أن نعزز هذه الثقافة في المجتمع لكي ينتشر الاحترام، ومن بعض الأهميات إبعاد الحقد والكراهية بين البشر وتوافر الأمن والأمان وتقوية العلاقات بين الأفراد. هناك تأثير كبير لوسائل التواصل الاجتماعي وخصوصا على الأطفال لأنها تسبب إدمانا غير إرادي وتضيعة وقت لمستخدمي الهواتف لفترة طويلة، فإن من الممكن أن يتأثر الفرد بما ينظر إليه في وسائل التواصل الاجتماعي وينتج هذا تغيرا في سلوك الشخص ومعاملته لأصدقائه أو أهله، كما أن هناك أيضا إيجابيات.,B1,100
AR-130-192949,تعد برامج التواصل الاجتماعي من البرامج الأكثر أهمية في وقتنا الحاضر لجميع الفئات العمرية مما ينتج عن ذلك عدة نتائج إيجابية وسلبية على الفرد والمجتمع. من أكثر البرامج الاجتماعية شهرة في هذا الوقت، والذي يتم عبره تداول جميع أنواع الأخبار عن شتى مجالات الحياة هو برنامج أو تطبيق (سنابتشات)، وهو عبارة عن برنامج متاح لجميع الفئات العمرية ويتم من خلاله التواصل مع أي شخص يستخدم هذا التطبيق ومشاركة الصور والفيديوهات القصيرة مع بعضهم البعض، كما يمكنك متابعة أي شخص سواء كان من المشاهير أو الممثلين. ومن آثاره الإيجابية هي أن تكون قادرا على معرفة جميع الأخبار وبكل سهولة وفي أي وقت. والآثار السلبية تنطبق على كيفية استخدام الشخص للبرامج كمتابعة الأشخاص الذين ينشرون أخبارا كاذبة أو سيئي التعامل.,B1,100
AR-130-193363,أصبح التواصل الاجتماعي شيئا يعيش معنا ويوجد الكثير من الناس الذين لا يستطيعون قضاء القليل من الوقت بدون تفقد التواصل الاجتماعي. لكل شيء في الحياة سلبياته وإيجابياته، والتواصل الاجتماعي أحد هذه الأشياء، لذلك سنذكر القليل من الإيجابيات والقليل من السلبيات. أولا من إيجابيات التواصل الاجتماعي هي أنه يمكن أن ترى أحوال الناس والأقرباء والأصدقاء عن طريق التواصل الاجتماعي، وتستطيع أيضا أن تتحدث مع أشخاص ولو كان يبعد بينكم الكثير من المسافات، التواصل الاجتماعي يجمعكم في لحظة ودقيقة. ومن سلبياته أنه يبعدك عن أهلك ويسبب لك الإدمان وعدم القدرة على التحمل بأن لا تتفقد التواصل الاجتماعي ويتسبب في جعلك شخصا عصبيا جدا.,B1,100
AR-130-193451,التسامح التسامح سمة وثقافة موجودة في جميع مجالات الحياة، التسامح هو سمة وثقافة عظيمة. يأتي التسامح في عدة أشكال، مثال على ذلك (التسامح في العقائد) و (التسامح مع الذات) و (التسامح وتقبل الاختلاف) إلخ.. مع اختلاف الزمن وتنوع الديانات يجب أن نعزز التسامح في العقائد وتقبل الاختلاف، لأن ثقافة التسامح هي العنصر الأساسي لجعل الشعوب تتعايش في سلام. ثقافة التسامح مع الذات هي عدم توبيخ النفس أو تعقيد الأمر على الذات وتحمل ما لا تستطيع. ولتعزيز التسامح مع الذات نجعل الشخص يتعاون في مساعدة الناس له وعدم تحمل مسؤولية ما لا يستطيع وإجهاد النفس. ثقافة التسامح وتقبل الاختلاف هي كاختلاف الجنس واختلاف العقيدة واختلاف الثقافة واختلاف العرق.,B1,100
AR-130-193838,وسائل التواصل الاجتماعي وتأثيرها على الفرد والمجتمع وسائل التواصل الاجتماعي هي وسيلة للتواصل بين الأفراد والمجتمع، لها أثر إيجابي وسلبي، الإيجابي مثل: التواصل بين الأقارب والأصدقاء واستكشاف البحوث العلمية وغيرها، والسلبي يوجد له أثر قوي منه: الجلوس لمدة طويلة وعدم الجلوس مع الأقارب - فهي تضيع الوقت - وعدم أداء بعض من الواجبات المفروضة. فعلى كل فرد أن يضع بين وسائل التواصل الاجتماعي وقتا كافيا لأداء واجباته، واستغلال الوقت الآخر بشيء مفيد له مثل: القراءة لتنمية مهارته والجلوس بين الأهل والاستمتاع بينهم.,B1,50
AR-130-194708,التطور الحضاري الذي تشهده دولة الإمارات بالحديث عن التطور في بداية السبعينات لم تشهد دولة الإمارات هذا التطور الملحوظ، ولكن مع العلم أصبحت دولتنا من الدول المتطورة والبارزة في شتى المجالات.,B1,0
AR-130-194718,دولة الإمارات العربية المتحدة من أفضل الدول التي تطورت بشكل سريع جدا، الكثير من الدول الأجنبية متطورة ولكنها بدأت بالتطور منذ قرون ودولة الإمارات لم تكمل قرنا منذ مسيرة الاتحاد. الشيخ زايد - طيب الله ثراه - استطاع أن يوحد دولة الإمارات وبدأ مسيرة الاتحاد مع المغفور له الشيخ راشد آل مكتوم. بعد مسيرة الاتحاد بدأت دولة الإمارات العربية المتحدة في التطور بشكل سريع في العديد من المجالات منها السياسية والاقتصادية. الشيخ زايد - طيب الله ثراه - بنى العديد من المدارس والمستشفيات والمنازل لمواطني دولة الإمارات، وهذا فخر كبير لكل مواطن يعيش على أرض هذه الدولة العظيمة. بعد وفاة الشيخ زايد - طيبه الله - لم تتوقف دولة الإمارات عن التطور ولكنها تطورت ووصلت للعالمية. الآن جميع الناس يعلمون ما هي مدينة دبي، إذا سألنا المارة في دولة غربية عن مدينة دبي فإنهم سيعرفونها لأنها من أعظم المدن. دبي أصبحت وجهة سياحية للكثير من الناس فإنها تستقبل ملايين السياح كل عام وهذا دليل كبير على تطورها. من الوجهات السياحية التي تكون مكتظة بالسياح هي برج خليفة وبرج العرب ودبي مول والعديد من الشواطئ التي يحبها السياح. بعض الإنجازات التي حققتها دولة الإمارات هي فوز دبي في برنامج إكسبو ٢٠٢٠ وإطلاق قمر صناعي مصنوع بأيدي إماراتية والكثير من الإنجازات التي لا تعد ولا تحصى. دولة الإمارات هي دولة متحضرة جدا وأنا فخورة لكوني مواطنة من دولة الإمارات وأعيش على أرضها. ودولة الإمارات لن تتوقف هنا بل سوف تستمر بالتطور وإبهار العالم بها.,B2,200
AR-130-195100,جميع الدول تسعى في التطور ومواكبة التطور، لذلك نرى الآن المجتمع أصبح منفتحا كثيرا وخاصة في هذا الزمن. والآن بدأ استخدام وسائل التواصل الاجتماعي المتعددة مثل السنابتشات وإنستجرام ويوتيوب وواتساب والكثير غيرها. جميعها إما بإمكان الإنسان استخدامها بشكل إيجابي والاستفادة منها أو استخدامها بشكل سلبي والتضرر منها، وتأثيرها كبير جدا على المجتمع وأيضا على الفرد. أضرار وسائل التواصل الاجتماعي على الفرد والمجتمع هي إضاعة الوقت والأمراض والصحبة غير الصالحة والانعزال وتغير في السلوكيات. يؤثر التواصل الاجتماعي على الفرد بشكل سلبي فيجعله منعزلا عن العالم الخارجي، يغير سلوكياته، يبعده عن العائلة. ولكن هناك إيجابيات أيضا، سهولة التواصل مع الآخرين وتثقيف أو إيصال فكرة جيدة عن طريقها. لكل شيء سلبياته وإيجابياته ولكن تعتمد على الشخص وتربيته وأخلاقه. إذا كنت تريد استخدام وسائل التواصل الاجتماعي بشكل إيجابي فسوف تستخدمه، أما إذا كنت تريد استخدامه بشكل سلبي فسوف تستخدمه بشكل سلبي وذلك عائد لكل شخص.,B1,100
AR-130-19632,كيف نعزز ثقافة التسامح في المجتمع؟ للتسامح طرق عديدة ومنها ما أوصانا به والدنا - المغفور له بإذن الله - الشيخ زايد بن سلطان آل نهيان. لكن هناك من قد يعزز هذه الطبيعة الجميلة وهناك من لا يحسب لها وجودا ويعتبرها تفاهة. فعند التسامح تتصافى القلوب وتتبارى الجروح وتتزين الحياة بنقاء قلوب أصحابها. ألا ليت لو قدر كل إمرئ هذه النعمة، وكل أخ وأخته، وكل صاحب وصاحبه، أو حتى كل جار لجاره. مع التسامح تتكون أعمدة السلام بين الدول.,B1,50
AR-130-197835,وسائل التواصل الاجتماعي هي مجموعة من البرامج والشبكات العنكبوتية التي تساعدك على الاتصال بالعالم، ويتم استخدامها عبر الأجهزة الإلكترونية مثل الهاتف أو الحاسوب وغيرها. وسائل التواصل الاجتماعي بدأت تغزو العالم وانتشرت بشكل كبير. وبطبيعة العالم فلكل شيء تأثيرات سلبية وإيجابية، فوسائل التواصل الاجتماعي أدت إلى تأثيرات كبيرة على الفرد بشكل خاص وعلى المجتمع بشكل عام. في عصرنا الحالي أصبحت وسائل التواصل في متناول الكل فلا يوجد عمر محدد لتستخدمها، وأدت إلى تأثير إيجابي وسلبي على الأفراد. ساعدت وسائل التواصل الاجتماعي الأفراد على زيادة ثقافاتهم وتعرفهم على الشعوب الأخرى، فوسائل التواصل الاجتماعي أتاحت الفرصة للأفراد لمعرفة ما يجري حول العالم من منازلهم، فساهمت سهولة استخدام مواقع التواصل الاجتماعي في التعرف على عادات الشعوب والتواصل معهم. كما أن مواقع التواصل الاجتماعي ساهمت في زيادة الترابط وتقوية العلاقات إذ إنها تسهل عملية التواصل بين الأصدقاء والأهل في حين أنك لا تمنعك ظروفك من الذهاب إليهم كالابتعاد مثلا. ولكن لا بد من وجود أثر سلبي، فطريقة استخدامك الخاطئة لمواقع التواصل الاجتماعي قد تعرضك للجرائم الإلكترونية، فلا بد من الحذر وعدم التحدث أو نشر بياناتك مع الجميع. لا بد من مراقبة الأطفال لأن مواقع التواصل الاجتماعي قد تكون وسائل تواصل اجتماعي ذات باب معرفة خاطئا للصغار. وبشكل عام فمواقع التواصل الاجتماعي ساهمت في زيادة الترابط بين الشعوب والمجتمع مما ينعكس إيجابيا على علاقاتهم، كما أنها تساعد المجتمعات على التقدم من خلال معرفة آخر أخبار العالم مما يولد شعور المنافسة والتحديات بينهم. علاوة على ذلك وسائل التواصل الاجتماعي تساهم في تبادل الثقافات ونشر الوعي بين أفراد المجتمع، فمن السهل استخدامها للتبليغ عن بعض الأخطار المهمة، إذ إن سرعة انتشار الخبر في مواقع التواصل سريعة جدا وتستطيع إيصال الرسالة لأكثر من فئة عمرية مختلفة. ولكن قد يكون لها تأثير سلبي أحيانا، فبعض المجتمعات لا تستشف الجيد من ثقافات غيرها بل يتم تقليد الثقافات واتباع ثقافة لا تتبع عاداتهم مما يؤثر سلبا على المجتمع، وقد يتم فقد الهوية الوطنية وفقد ثقافتها وعاداتها. لكل شيء ينشر آثار سلبية وإيجابية على الفرد وعلى المجتمع ولكن هذا التأثير يعتمد على طريق استخدامنا وفهمنا لهذا الشيء فالتأثير لا يأتي إلا باختيارك أنت، فلا بد من نشر الوعي لتفادي الآثار السلبية التي قد تؤثر على الفرد وعلى المجتمع.,B2,350
