Document_ID,Essay,CEFR,word_count
AR-030-268469,وسائل التواصل الاجتماعي لها أضرار وفوائد كثيرة. ولكن بان في الآونة الأخيرة أن مضارها أكبر بكثير من منافعها. فإذا نشأ الطفل وبيده هاتف أو جهاز إلكتروني ستلاحظ عدم قدرته على الاستجابة بسرعة. وأيضا سوف تلاحظ عدم قدرته على التركيز. ومضار التواصل الاجتماعي لم تكتف بالأطفال والمراهقين فقط بل بجميع الفئات العمرية. فكم من شخص قد رحل من هذه الدنيا بسبب حادث سيارة، وسببه الهاتف المتحرك ليتفقد الشخص صفحة على مواقع التواصل الاجتماعي. أيضا مقارنة بمجالس الشباب سابقا قبل ظهور مواقع التواصل، لرأيت شبابا يضحكون مع بعضهم أو لربما يلعبون لعبة ما، أما الآن فترى شبابا جالسين جنبهم الجنب ولا يتكلمون مع بعضهم البعض وتراهم جميعا على مواقع التواصل الاجتماعي. التواصل الاجتماعي أثر كثيرا على عاداتنا كبشر وكمجتمع. وترى أيضا امرأة إما مشغولة عن أبنائها بالتواصل الاجتماعي أو موظفا مشغولا بهاتفه أثناء أوقات الدوام. مواقع التواصل الاجتماعي كسيف ذي حدين ولكن أصبحت مضارها أكثر من منافعها. أصبحت تميل إلى نوع من أنواع الإدمان الذي يجب الحذر منه.,B1,150
AR-030-386369,تعد وسائل التواصل الاجتماعي من أكبر المؤثرات على الفرد في مجتمعنا الحالي، وذلك بسبب إدمان الفرد على استخدامها بشكل متواصل ويومي. تتنوع المؤثرات - منها الإيجابية والسلبية - على الأفراد في دولتنا. الإيجابية منها سرعة التواصل وسهولته وتنوعه كالرسائل الفورية والصوتية والتواصل المرئي والصوتي. أيضا يمكن للفائدة أن تشمل الناس عامة في وظائفهم من خلال تمكنهم من استخدام البريد الإلكتروني والاجتماعات من خلال هذه الوسائل. ومن السلبيات التي تنتج من وسائل التواصل الاجتماعي الابتزاز الإلكتروني وهي ظاهرة منتشرة في الآونة الأخيرة، وغير ذلك إضاعة الوقت الذي يمكن استثماره بفائدة أخرى. ومن أمثلة إضاعة الوقت قضاء وقت العمل على وسائل التواصل الاجتماعي لإضاعته. ومن مؤثرات الوسائل على المجتمع أن تنتشر الإشاعات التي تولد وتزيد من المشاكل ومنها المشاكل الأسرية والاجتماعية والسياسية وغيرها. وعلى سبيل التأثير الإيجابي من الممكن أن تنتشر التوعية في بعض المجالات على المجتمع من خلال وسائل التواصل. أيضا من الممكن أن تنتشر بعض الثقافات الإيجابية على المجتمع من خلال وسائل التواصل كالقراءة.,B2,150
AR-030-81027,قام انتشار وسائل التواصل الاجتماعي بشكل كبير وهذا أثر على المجتمع بشكل إيجابي وسلبي. من الآثار الإيجابية للتواصل الاجتماعي التواصل مع الناس بشكل أسهل، ومن الآثار السلبية انتشار الكراهية والفساد بين الناس.,A2,0
AR-030-81757,وسائل التواصل الاجتماعي لقد تطورت وسائل المعرفة والتقدم واجتاحت وسائل التواصل الاجتماعي منازلنا وحياتنا وأيضا مائدة طعامنا دون استئذان. فللأسف أصبحت فردا من العائلة، فردا غير مرحب به، ولكنه متواجد رغما عنا، فقد أصبح مسيطرا على خلايا أدمغتنا وحواسنا. لا أنكر أن هذا الفرد قرب لنا البعيد، ولكن مع ذلك أبعد القريب، وأصبحت الأخبار بوجوده تصلنا بعد ثوان من حدوثها حتى إن كانت من مشرق الأرض أو مغربها، فهو يجمع العالم كله في شاشة لامعة صغيرة. ولكن لنتحدث بكل أريحية وصراحة، مواقع التواصل الاجتماعي أصبحت عبارة عن أداة ذات حدين قد تدمر حياتك أو حياة أي شخص آخر بكبسة زر، وقد تشرق حياة أحدهم من ذات كبسة الزر تلك. ولكن هذا بالطبع يعتمد علينا نحن كأفراد على مدى سيطرة تلك الشاشات علينا. علينا عدم الاستسلام والعيش في عالم قد يزول بمجرد أن نطفئ الإنترنت، علينا مزاولة العيش في حياتنا الواقعية. ومع ذلك يجب علينا مواكبة التطور ولكن ليس للحد الذي يجعلنا ننسى من نحن أو من حولنا. وبالأخير لكل شيء مضار ومنافع وعلينا توخي الحذر وتوسيع مدارك أفكارنا وتحمل مسؤولية أفعالنا، فهي ستؤثر علينا وعلى عوائلنا ومجتمعنا. فلكم أن تتخيلوا مجتمعا كاملا يقتات في إحدى هذه الشاشات ويحيا بين كبسة زر وأخرى والإشاعات تجتاحه، بالطبع سيدمر من أساسه حتى آخره. وأخيرا مثلما قلت علينا توخي الحذر دائما وأبدا.,B2,200
AR-030-83625,من أشهر وسائل الاتصال بالآخرين هي الاجتماعية.,Unassessable,0
AR-030-85891,التواصل الاجتماعي من أخطر الأشياء لأنه يبعدنا عن والدينا ولا يعطينا الوقت الكافي للجلوس معهم وذلك يؤثر في عقولنا وتصرفاتنا بشكل سلبي وليس جيدا أبدا. لذلك يجب علينا أن لا نستخدمه كثيرا وننتبه له.,A2,0
AR-030-87953,يوجد الكثير من الطرق لكي نعزز ثقافة التسامح في المجتمع ومن الممكن تطويرها ونشرها إلى دول أخرى لكي نحصل على انطباع جيد من الزوار والناس عامة، ومنها نشر أوراق توعية تدل على أهمية عزيمتها ومدى تقديرها للشعب. ومن الممكن إلقاء محاضرات في المدارس للكبار والصغار بطريقة مبتكرة لكي لا يشعروا بالملل، ومن الممكن أن يستفيدوا من هذا الشيء. التطور جدا مهم في دولة الإمارات العربية المتحدة، حيث إني شهدت أن دولة الإمارات العربية المتحدة هي الأكثر تطويرا في العالم بأكمله ومع مرور الوقت سوف يزداد هذا التطور وسوف تتطور في الحضارة وسوف يشهد الشعب أن هذه دولة متكاملة ودولة مستعمرة، حيث إن الشيخ زايد - رحمه الله - وجميع حكام دولة الإمارات حرصوا على التطوير الحضاري أكثر من كل شيء، فيجب أن نشعر بالأمان والانتماء لهذه النعمة التي أعطونا إياها. لدى التواصل الاجتماعي تأثير قوي لدى الشعب وأصبحنا لا يمكننا العيش بدونه حيث أصبح جميع الناس من كل النواحي لديهم هاتف محمول وإلكترونيات ومنها الأكثر.,B1,150
AR-030-89249,يعتبر التسامح النوعية الجيدة ومن الضروري لنا كمجتمع، وفي هذا المجتمع يبدو أن معدل التسامح انخفض مع مرور الأيام، الناس لا يحبون رأي الآخرين وحتى في تفكيرهم، يجب تطوير التسامح في مجتمعنا، حاليا اعط فرصة للآخرين لتطوير أنفسهم. التسامح هو الشيء الرئيسي في التعليم لأي شخص، التفكير بما يفعلونه يخلق صراعات بينهم والنقاشات في الأشياء الصغيرة ليس لها ضرورة، التسامح يجب أن يكون لنا واجبا فهو يمثل شخصيتك وأسلوبك وهذا السلوك لا يخلق شخصا مثاليا بل يحفز الآخرين أيضا على التسامح مع الآخرين، يجب أن يأخذ دورا كبيرا في مجتمعنا لهذه الأسباب.,B1,50
AR-030-89881,في عصرنا هذا أصبح التواصل الاجتماعي شيئا أساسيا نستخدمه بشكل يومي. للتواصل الاجتماعي الكثير من الإيجابيات والسلبيات التي أثرت على حياتنا بشكل ملحوظ. من إيجابيات التواصل الاجتماعي أنه عمل على تسهيل التواصل بين البشر وجعلنا نتعلم ونتعرف على ثقافات مختلفة.,B1,0
AR-030-90528,"التواصل الاجتماعي له أثر جدا كبير في مجتمعنا الحالي. الإنترنت غير الإنسان بشكل غير طبيعي، وفي رأيي غير الإنسان للأسوأ لأنه مشغول طوال اليوم يتواصل مع الناس ولم يكن لديه أي وقت فراغ ليجلس مع أهله وعائلته. لم أنكر فيه إيجابيات كثيرة مثل تمكن الإنسان من التواصل مع فرد خارج الدولة وممكن أيضا أن يبحث عن معلومات في ""جوجل"" ليساعده في مثلا واجب. المجتمع تحسن بسبب التواصل الاجتماعي في التكنولوجيا الذي ساعد في تطور الدولة والعالم، والفرد يريد أن يطور مجتمعه وليطور مجتمع يحتاج إلى التواصل الاجتماعي لكي يعرف المجتمع إلى أي حد مطور ليعمل شيئا جديدا وغير مألوف لأن بهذه الطريقة المجتمع سيتطور إلى الأفضل. فيه طرف ثان للتواصل الاجتماعي مثل ""إنستجرام"" و ""تويتر"" و ""سنابتشات""، هذه البرامج يستخدمونها ليتواصلوا مع أصدقائهم وأحبائهم وممكن أن يرسلوا صورا أو فيديو لبعضهم ليعرفوا أخبار بعض. هذا الشيء جيد إذا استخدموه بالطريقة الصحيحة وإذا استخدموه بطريقة خاطئة سيفسد المجتمع بشكل كبير وخاطئ.",A2,150
AR-030-92524,خلق الله تعالى هذه الأمم والشعوب للتعارف والتفاهم والتصالح مع بعضهم البعض. التسامح شيء مهم في حياتنا اليومية والدينية، وللتسامح العديد من الفوائد منها تعريف الناس على بعضهم البعض وعلى الثقافات والحضارات والعلوم الموجودة لدى الآخرين. وقد يتسبب التسامح بشعور الأمن والأمان. يعتقد الكثير من الناس أن التطور هو استخدام كل ما هو جديد أو حديث ولكن مفهوم التطور هو استكشاف أشياء موجودة قديمة تنفع للمستقبل والقيام بإعادة صناعتها لكي تبقى صامدة. التطور الحضاري في دولة الإمارات بدأ من اكتشاف المواهب الموجودة في أفراد المجتمع وتعزيزهم في إظهارها للدولة للإستفادة منها، ومن هذا الشيء بدأت دولة الإمارات بالتطور ومساعدة الدول الأخرى. ما يتميز به العصر الحديث هو التقدم الكبير في تكنولوجيا الاتصال والتواصل. ظهرت هذه الوسائل كإنجاز حضاري استنتجته العقول الذكية العملاقة. لقد أثرت التكنولوجيا على العالم بأكمله. لدى التكنولوجيا العديد من السلبيات والإيجابيات ولكن الكثير من السلبيات علينا أن لا نهملها أو نتجاهلها، وإنها مدخل مناسب للأعداء لتتبع الشباب ومتابعة أنشطتهم المختلفة. وإن التكنولوجيا مكان مناسب للتخطيط لنشر الجريمة والتطرف أحيانا.,B1,150
AR-030-92800,يجب على كل فرد أن يساهم في التسامح وحث الآخرين على هذا التصرف الإيجابي. على المجتمع أن يعزز من ثقافة التسامح في المجتمع من خلال اطلاع الناس على مدى أهمية هذا الشيء. إن دولة الإمارات تشهد أكبر تطور حضاري لم تشهد مثله من قبل. وتتم وسائل التواصل الاجتماعي بالتأثير على الفرد والمجتمع.,B1,50
AR-030-93360,تسامحوا تسامحوا: لا شك كل إنسان يخطو على هذه الأرض قد مر من قبل بمواقف كثيرة يقشعر لبعضها البدن وبعضها قد يكون بنظره لا تغتفر، في حين أن البعض الآخر قد لا يلقي لها بالا أو يرى أنها أتفه من أن تجعله يتجاهل وجود شخص ما... وهنا يأتي الأمر، فتكون المعضلة في الشخص نفسه وفي كيف سيختار ما سيتصرف به وما إذا كان سيسامح أم لا. لقد حثنا الدين الإسلامي البليغ على ثقافة التسامح ورفع من شأنه، ولعل أول سبب يجعلنا لا نتهاون فيه هو أن القطيعة لمدة تزيد عن ثلاثة أيام تضعنا تحت خطر جسيم، وهو أن أعمالنا لا ترفع ولا تقبل حتى تنهى هذه القطيعة، فبالنسبة لي هذا السبب أكثر من كاف حتى أسامح غيري. فلو حاولنا أن نكون متسامحين يمكننا بذلك أن نكون قدوة لغيرنا، كما أن نشر الوعي بشأن هذا الأمر سيعزز من ثقافة التسامح في المجتمع خصيصا لو رأى الناس أن هذا الأمر وهو (‪@@‬ المسامحة) أصبح شائعا في أحيائهم سينساقون خلفه لا شعوريا، فمن عاشر قوما أصبح مثلهم. ختاما علينا أن لا ننسى كم من الأخطاء التي ارتكبناها في حياتنا والتي ربما لا زلنا نستمر في ارتكابها، ولكن يظل الله يسامحنا عليها، فسامحوا من في الأرض... يسامحكم من في السماء.,B2,200
AR-030-96339,ما يتميز به العصر الحديث هو التقدم في التكنولوجيا، وصفات التواصل الاجتماعي متعددة في أنواع وأشكال التكنولوجيا المتطورة أكثر. توجد أضرار كبيرة في التواصل الاجتماعي وهي الانشغال عن أداء بعض الواجبات سواء الأسرية أو في جوانب أداء العمل الوظيفي المختلفة. ويوجد ضرر كبير مثل أنه مدخل لنشر ثقافة الانحلال الخلقي والفساد المجتمعي وعدم الثقة وهو عبارة عن مجتمع مفتوح أمام كل المجتمعات، وتكون أحيانا فيه فرصة قوية لنشر الإشاعات وترويجها. وفي مختلف جوانب الحياة وليس فقط التواصل الاجتماعي توجد فيه أضرار بل توجد فيه فوائد كثيرة ومنها تبادل الخبرات الحياتية في مجالات الحياة المتعددة والمعلومات الهامة من مصادرها التي توفرها من خلال تسجيلات الإعجاب والتابعة لبعضها، وتفسح المجال أمام الإبداع في رسم اجتهادات فكرية وثقافية وسياسية معينة. وإن وسائل التواصل الاجتماعي هي منجزات حضارية عظيمة، والإنسان وحده الذي يملك طريقة الاستفادة منها.,B1,150
AR-030-96683,وسائل التواصل الاجتماعي شهد العالم في القرن السابق تطورات عدة ومنها بدأت وسائل التواصل الاجتماعي في قرننا هذا في الانتشار. وبدأت تزيد أهميتها يوما بعد يوم وبدا تأثيرها واضحا على الفرد والمجتمع كثيرا، كما أنه بدا بكونه شيئا فائق الأهمية في بيوتنا وعصرنا هذا. لكن هناك تأثيرات سلبية وإيجابية للمجتمع والفرد. كما ذكرت سابقا أن لوسائل التواصل الاجتماعي إيجابيات منها: سهولة التواصل بين المجتمع والفرد. مثلا تواصل الفرد من مكان بعيد بشخص أو مجموعة أناس يعيشون في بلدة أو مكان آخر. والفرد يمكنه تزويد نفسه بالمعلومات المهمة وإجراء بحوث عن طريق التواصل الاجتماعي. أما الجانب السلبي للمجتمع قد تبدأ خلافات بينهم بسبب وسائل التواصل الاجتماعي وكلام غير صحيح أو أن تكون إشاعة. وتنتشر هذه الإشاعة في المجتمع أسرع بسبب سهولة التواصل وتداول المعلومات في وسائل التواصل الاجتماعي. وأيضا قد تكون هناك عمليات نصب أكثر في هذه الوسائل بسبب سهولة البقاء مجهولا وراء الشاشة.,B1,150
AR-030-97791,لقد وقعت الكثير من التطورات الحضارية من قبل هؤلاء الناس العباقرة الذين أتوا إلينا من جميع نواحي الدول وعززوا دولة الإمارات. فقد قدموا إلينا جميع احتياجاتنا، وكل ما أردناه هو مجتمعا آمنا وخال من المشاكل والمتاعب. قدمت لنا دولة الإمارات العربية المتحدة أولا مكانا آمنا، وهو سبب من الأسباب لماذا الناس يأتون من دول أخرى بعيدة إلى هنا، فقد بنوا لنا أفخر المطاعم وأعلى المدارس والجامعات، أيضا وفروا لنا شوارع وطرقا منظمة وقوانين تطبق لكل شخص متاح في دولة الإمارات العربية المتحدة. أتت هذه الأفكار الخلابة والمذهلة من كل دولة ممكنة. ومن الأكيد دولتنا فعلت الكثير من البحوثات وذهبت إلى أماكن أخرى لاستكشاف العالم بأكمله والتمكن من الاستطلاع لأفكار وطريقة بنائها بطريقة فريدة ومثالية، فهذا يستغرق الكثير من الوقت والجهد. فأنا فخورة جدا بكوني إماراتية.,B1,100
AR-130-119813,التواصل الاجتماعي له سلبيات وإيجابيات لكن قد يؤثر بطريقة سلبية أكثر على الفرد. الكثير من الناس يستخدمون التواصل الاجتماعي بطريقة خاطئة. يقتبس الفرد الكثير من التواصل الاجتماعي ويتأثر وقد يؤثر عليه بطريقة خاطئة كما ذكرنا.,A2,0
AR-130-119831,فيه عديد من الناس كانت ثقافتهم سيئة، ما كانوا منضمين لمجتمع وفيه بعضهم مع ناس. الحياة هي أصلا حياة الإنسان، كيف يعيش على الأرض، هذا واجب علينا أن نتعامل معهم [INCOMPLETE],Unassessable,0
AR-130-121991965,لوسائل التواصل الاجتماعي تأثير على الفرد والمجتمع، منها تأثير إيجابي ومنها سلبي. تأثير التواصل الاجتماعي السلبي على الفرد: هو أن الفرد يستخدمه بطريقة غير لائقة تسبب له المشاكل والأمراض، ونقصد بالأمراض أن الفرد أصبح لا يريد التحرك أو الخروج خارج المنزل أو ممارسة الرياضة، أصبح فقط يريد الأكل واستخدام وسائل التواصل الاجتماعي. أما بالنسبة للجانب الإيجابي هو أن الفرد يستطيع أن يستخدم هذه الوسائل للدراسة أو التواصل مع أحد المدرسين للاستفسار عن سؤال أو التواصل مع شخص عزيز مقرب أو بعيد عنه. كما أنها من الممكن أن تقرب علاقة الأفراد ببعضهم. أما بالنسبة لتأثيرها على المجتمع فهي تنمي المجتمع وترقيه.,B1,100
AR-130-165859,وسائل التواصل الاجتماعي بات يستخدمها الصغير والكبير. هي عالم آخر يلجأ إليه الفرد ليقضي فيه بعض الوقت. لكنها سلاح ذو حدين قد يفيد من يحسن استخدامه في التواصل مع الأصدقاء والتطلع إلى آخر الأخبار وقد يستخدمه البعض للتجارة وربح الأموال. ولكن هناك سلبيات كثيرة لمن يسيء استخدامه ويؤدي إلى ضياعه. على سبيل المثال إدمان هذه المواقع يؤدي إلى كوارث على الفرد ذاته والمجتمع أيضا، مثل مشاكل الطلاق والتشتت الأسري وأيضا ضياع الأبناء لعدم رقابة الوالدين. وضياع الأسرة من ضياع المجتمع لأن الأسرة السليمة هي الأساس لبناء مجتمع سليم.,B2,50
AR-130-165949,ثقافة التسامح تعتبر ثقافة التسامح من أهم الثقافات التي يجب تعزيزها في كل المجتمعات سواء كانت عربية أو أجنبية. وقد حرصت دولة الإمارات العربية المتحدة على غرس ثقافة التسامح بين أبناء شعبها من خلال إطلاق اسم عام التسامح على عام ٢٠١٩. ومن خلال هذه المبادرة تم عمل محاضرات وتجمعات وملتقيات لنشر ثقافة التسامح ولتعريف أبناء الشعب عليها أكثر. وقد ساهمت هذه الطرق في نشر ثقافة التسامح أكثر وتعزيزها بين الشعب الإماراتي، وساهمت في تشجيع كل مواطن على نشر هذه الثقافة بين أفراد أسرته والبيئة المحيطة به عن طريق تعليمهم ما قد تعلمه عن ثقافة التسامح في الملتقيات والمحاضرات التي حضرها من قبل. أيضا من الطرق الأخرى التي تساعد الناس على تعزيز ثقافة التسامح فيهم هي الاقتداء برسولنا الكريم محمد صلى الله عليه وسلم، فهو قدوتنا في التسامح والصفح والعفو. فيجب على المرء أن يحتسب الأجر ويسامح ويعفو عند المقدرة.,B1,100
